question,answer,type,points,media_url,category,difficulty,answer_mode,question_format,approved,options
Which country has no land border with Russia?,Uzbekistan,text,1,,,medium,mcq,multichoice,FALSE,Mongolia|North Korea|Norway|Uzbekistan
"In an episode of The Simpsons, Marge belatedly receives a letter from which Beatle?",Ringo Starr,text,1,,,medium,mcq,multichoice,FALSE,John Lennon|Paul McCartney|George Harrison|Ringo Starr
This film features a glowing briefcase. Its title is an anagram of 'UPLIFT PICON'. What is the film?,Pulp Fiction,text,1,,,medium,text,standard,FALSE,
In which country did the Great Leap Forward take place?,China,text,1,,,medium,text,standard,FALSE,
A squid has _____ an octopus.,More limbs than,text,1,,,medium,mcq,standard,FALSE,Less limbs than|The same amount|More limbs than
Which franchise did NOT have music composed by John Williams?,Batman,text,1,,,medium,mcq,standard,FALSE,Batman|Jurassic Park|Harry Potter|Star Wars
What is the English translation of the French 'Mon Dieu!'?,My God,text,1,,,medium,text,standard,FALSE,
A man's formal dress coat called 'tails' is named after what bird?,Swallow,text,1,,Birds,medium,text,standard,FALSE,
"Venerated in Hindu and Greek mythology, what is the National Bird of India?",Peacock,text,1,,Birds,medium,text,standard,FALSE,
"Some birds can briefly fly upside down, what's the only type of bird that can do it for a sustained period?",Hummingbird,text,1,,Birds,medium,text,standard,FALSE,
"What name is given to the nest of an eagle, falcon, hawk, or other bird of prey?",Eyrie,text,1,,Birds,medium,text,standard,FALSE,
"In English superstition what black and white bird should you wish ""good day""?",Magpie,text,1,,Birds,medium,text,standard,FALSE,
What bird is depicted on most Canadian one-dollar coins and gives them their nickname?,Common Loon,text,1,,Birds,medium,text,standard,FALSE,
Who understood the speech of birds after tasting dragon's blood in a famous Richard Wagner opera?,Siegfried,text,1,,Birds,medium,text,standard,FALSE,
What type of birds (called Hugin & Munin) sit on the shoulders of Odin?,Ravens,text,1,,Birds,medium,text,standard,FALSE,
"In his play 'The Birds', what name did Aristophanes give to the birds' kingdom in the sky?",Cloud Cuckoo Land,text,1,,Birds,medium,text,standard,FALSE,
"What type of bird is associated with Lundy Island, it is a seabird in the auk family?",Atlantic Puffin,text,1,,Birds,medium,text,standard,FALSE,
What type of animal is Pluto in the Disney cartoons?,Dog,text,1,,Entertainment,medium,text,standard,FALSE,
"Among these unsettling food-related powers, which one genuinely belongs to a mutant in the Marvel universe?",The ability to transform into any flavor of ice cream,text,1,,Entertainment,medium,mcq,standard,FALSE,The ability to transform into any flavor of ice cream.|Having hair that grows into edible pasta.|Crying tears that taste like clam chowder.|Sweating pure mayonnaise.
What type of magical object does Aladdin ride through the sky?,Carpet,text,1,,Entertainment,medium,text,standard,FALSE,
What is the name of the superhero alter ego of Steve Rogers?,Captain America,text,1,,Entertainment,medium,text,standard,FALSE,
Alan Reed is known for providing the voice of which character?,Fred Flintstone,text,1,,Entertainment,medium,mcq,standard,FALSE,Fred Flintstone|Fangface|G.I. Joe|Bugs Bunny
How many Harrison Ford's are there on Hollywood's Walk of Fame?,2,text,1,,Entertainment,medium,mcq,standard,FALSE,2|0|3|1
The USA banned authentic Scottish haggis due to its inclusion of which specific ingredient?,Sheep's lung,text,1,,Food & Drink,medium,mcq,standard,FALSE,Sheep's brain|Pig's blood|Sheep's lung|Goat's heart
What is the main ingredient in traditional hummus?,Chickpeas,text,1,,Food & Drink,medium,text,standard,FALSE,
What is the name of the chocolate brand famous for its Creme Egg?,Cadbury,text,1,,Food & Drink,medium,text,standard,FALSE,
Which two creatures are depicted on the United Kingdom's coat of arms?,A lion and a unicorn,text,1,,General Knowledge,medium,text,standard,FALSE,
Which of the following is NOT a literary bear?,Clifford,text,1,,General Knowledge,medium,mcq,standard,FALSE,Clifford|Corduroy|Winnie the Pooh|Paddington
Which country is the birthplace of Lego?,Denmark,text,1,,General Knowledge,medium,text,standard,FALSE,
"George Clooney co-founded which tequila brand, selling it in 2017 for an estimated $1 billion?",Casamigos,text,1,,General Knowledge,medium,mcq,standard,FALSE,Teremana|Casamigos|Patron|Don Julio
What color paint is used on Disney structures to make them 'disappear' against the sky?,Go-Away Green,text,1,,General Knowledge,medium,mcq,standard,FALSE,Vanishing Gray|Blending Blue|No-See-Um Navy|Go-Away Green
Psithurism describes the sound of what?,Leaves rustling in the wind,text,1,,General Knowledge,medium,mcq,standard,FALSE,"The voice in your head|Leaves rustling in the wind|A whistly nostril|A great disturbance in the Force, as if millions of voices suddenly cried out in terror and were suddenly silenced"
"First airing in 2014, which adult animated psychological comedy drama series revolves around an anthropomorphic horse, a washed-up star of a 1990s sitcom?",BoJack Horseman,text,1,,General Knowledge,medium,text,standard,FALSE,
What was the name of the band who backed Prince on the album Purple Rain?,The Revolution,text,1,,General Knowledge,medium,text,standard,FALSE,
"Caviar comes from several species of which fish - beluga caviar is the largest, rarest, and the most expensive?",Sturgeon,text,1,,General Knowledge,medium,text,standard,FALSE,
"What common dog breed takes its name from the fact that they were originally bred to hunt a game bird called ""woodcocks""?",Cocker Spaniel,text,1,,General Knowledge,medium,text,standard,FALSE,
"Similar to, but much larger than the asteroid belt, what is the circumstellar disc in the outer Solar System, extending from the orbit of Neptune?",The Kuiper Belt,text,1,,General Knowledge,medium,text,standard,FALSE,
"H.G Wells' first novel, in which book do the Eloi and the Morlocks feature?",The Time Machine,text,1,,General Knowledge,medium,text,standard,FALSE,
Which European peak was first conquered in 1865 by English mountaineer Edward Whymper?,Matterhorn,text,1,,General Knowledge,medium,text,standard,FALSE,
"Which scavenger and mammal has Brown, Spotted, and Striped varieties?",Hyena,text,1,,General Knowledge,medium,text,standard,FALSE,
"Meaning ""knowledge"", what is the name given to the large body of religious texts originating in ancient India?",The Vedas,text,1,,General Knowledge,medium,text,standard,FALSE,
"In which film is ""Auto"" a rogue autopilot AI aboard the starliner Axiom, preventing humans from returning to Earth?",WALL-E,text,1,,General Knowledge,medium,text,standard,FALSE,
"Which Beatle wrote and sang the song ""Why Don't We Do It in the Road"" after being inspired by seeing two monkeys copulating in the street?",Paul,text,1,,General Knowledge,medium,mcq,standard,FALSE,George|Ringo|John|Paul
"According to The Hitchhiker's Guide to the Galaxy book, the answer to life, the universe and everything else is...",42,text,1,,General Knowledge,medium,mcq,standard,FALSE,Loving everyone around you|Chocolate|Death|42
What is the collective noun for bears?,Sloth,text,1,,General Knowledge,medium,mcq,standard,FALSE,Drove|Tribe|Husk|Sloth
"The 'Poodle Skirt,' an iconic 1950s fashion piece, was most commonly made from what non-woven fabric?",Felt,text,1,,General Knowledge,medium,mcq,standard,FALSE,Leather|Felt|Satin|Denim
The iconic bat on the Bacardi logo was inspired by what creatures found in the distillery?,Fruit bats,text,1,,General Knowledge,medium,mcq,standard,FALSE,Fruit bats|Little brown bats|Flying foxes|Vampire bats
The metal band that secures the eraser to the end of a pencil is called a what?,Ferrule,text,1,,General Knowledge,medium,mcq,standard,FALSE,Ferrule|Caplet|Aglet|Collar
The casual 'espadrille' shoe is traditionally defined by having a sole made from what kind of rope?,Jute,text,1,,General Knowledge,medium,mcq,standard,FALSE,Nylon|Cotton|Sisal|Jute
"'Poang' is a classic IKEA armchair. In Swedish, what does the word 'poang' actually mean?",Point or punchline,text,1,,General Knowledge,medium,mcq,standard,FALSE,Wood|Simplicity|Point or punchline|Comfort
Which South American country has the capital city of Quito?,Ecuador,text,1,,Geography,medium,both,standard,FALSE,Colombia|Ecuador|Paraguay|Guyana
"Until 2011, the flag of which nation was unique for consisting of a single, solid green color?",Libya,text,1,,Geography,medium,mcq,standard,FALSE,Mauritania|Pakistan|Libya|Saudi Arabia
Which UNESCO World Heritage site is located on the coast of Northern Ireland?,Giant's Causeway,text,1,,Geography,medium,mcq,standard,FALSE,Giant's Causeway|Durdle Door|Fingal's Cave|Old Man of Hoy
What is the capital city of Bangladesh?,Dhaka,text,1,,Geography,medium,text,standard,FALSE,
Which river flows through Vienna and Budapest?,Danube,text,1,,Geography,medium,text,standard,FALSE,
"Which English county boasts the longest coastline, stretching over 400 miles?",Cornwall,text,1,,Geography,medium,mcq,standard,FALSE,Kent|Cornwall|Devon|Yorkshire
Which city is located farther west?,"Reykjavik, Iceland",text,1,,Geography,medium,mcq,standard,FALSE,"Reykjavik, Iceland|Lisbon, Portugal|Dublin, Ireland|Dakar, Senegal"
Which of these European nations shares a border with Germany?,Luxembourg,text,1,,Geography,medium,mcq,standard,FALSE,Romania|Hungary|Slovakia|Luxembourg
What is the capital city of Venezuela?,Caracas,text,1,,Geography,medium,text,standard,FALSE,
Which of these countries shares a border with the South American territory French Guiana?,Brazil,text,1,,Geography,medium,mcq,standard,FALSE,Guyana|Brazil|Colombia|Venezuela
What type of U-shaped lake forms when a wide meander from a river is cut off?,Oxbow lake,text,1,,Geography,medium,mcq,standard,FALSE,Oxbow lake|Crater lake|Tarn|Kettle lake
How many passenger capsules are there on the London Eye observation wheel?,32,text,1,,Geography,medium,mcq,standard,FALSE,30|32|24|40
"Which came first, the first FIFA World Cup or the first Academy Awards ceremony?",Academy Awards (1929 vs 1930),text,1,,History,medium,text,standard,FALSE,
Which of the following sculptures was made by Auguste Rodin?,The Thinker,text,1,,History,medium,mcq,standard,FALSE,La Pieta|The Venus de Milo|The Thinker|The Little Mermaid
"Bank of America was originally founded in 1904 under what name, to serve immigrants in San Francisco?",Bank of Italy,text,1,,History,medium,mcq,standard,FALSE,Bank of California|Bank of the West|Bank of Italy|Bank of San Francisco
What was the surprising first role of Ugandan dictator Idi Amin in the British colonial army?,An assistant cook,text,1,,History,medium,mcq,standard,FALSE,An assistant cook|A radio operator|A vehicle mechanic|An infantry scout
"What small, golden item, a traditional symbol of peace, did the Apollo 11 crew leave on the Moon?",An olive branch,text,1,,History,medium,mcq,standard,FALSE,A peace sign medallion|A dove feather|A white rose|An olive branch
Which Egyptian queen was famously associated with Julius Caesar and Mark Antony?,Cleopatra,text,1,,History,medium,text,standard,FALSE,
"Argentina's influential First Lady, Eva Peron, first gained fame in what line of work?",Radio soap opera actress,text,1,,History,medium,mcq,standard,FALSE,Tango dancer|Radio soap opera actress|Fashion model|Stage magician's assistant
"When Captain James Cook first charted Hawaii, what title did he give to the archipelago?",The Sandwich Islands,text,1,,History,medium,mcq,standard,FALSE,The Aloha Isles|The Paradise Isles|The Sandwich Islands|The Polynesian Isles
What is the surname of the author that wrote Charlie and the Chocolate Factory?,Dahl,text,1,,Literature,medium,text,standard,FALSE,
What is the name of the author who wrote A Christmas Carol?,Charles Dickens,text,1,,Literature,medium,text,standard,FALSE,
"Annie Wilkes, the unhinged fan who imprisons her favorite novelist in the film Misery is played by which actor?",Kathy Bates,text,1,,Movies,medium,text,standard,FALSE,
What type of arachnid famously crawls on Sean Connery's chest in a tense scene in 'Dr. No'?,A common tarantula,text,1,,Movies,medium,mcq,standard,FALSE,A funnel-web spider|A common tarantula|A brown recluse|A black widow
"What is E.T.'s favorite candy, which Elliot uses to lure the alien out of hiding?",Reese's Pieces,text,1,,Movies,medium,mcq,standard,FALSE,Reese's Pieces|Jelly Beans|M&Ms|Skittles
Which movie ends with Average Joe's defeating the Purple Cobras?,Dodgeball,text,1,,Movies,medium,text,standard,FALSE,
Whitney Houston and Mariah Carey's duet was created for which animated film's soundtrack?,The Prince of Egypt,text,1,,Movies,medium,mcq,standard,FALSE,Anastasia|Mulan|The Prince of Egypt|Pocahontas
"Which 1992 film featured Whitney Houston's massive hit ""I Will Always Love You""?",The Bodyguard,text,1,,Movies,medium,text,standard,FALSE,
"Hannibal Lecter, the psychiatrist and cannibal who helps catch another serial killer in The Silence of the Lambs is played by which actor?",Anthony Hopkins,text,1,,Movies,medium,text,standard,FALSE,
The Sith Lord Darth Vader who enforces the Galactic Empire in The Empire Strikes Back is played by which actor?,David Prowse,text,1,,Movies,medium,text,standard,FALSE,
"Alex Forrest, the obsessive lover who terrorizes a married man's family in Fatal Attraction is played by which actor?",Glenn Close,text,1,,Movies,medium,text,standard,FALSE,
"Alex DeLarge, the charismatic delinquent who revels in ultraviolence in A Clockwork Orange is played by which actor?",Malcolm McDowell,text,1,,Movies,medium,text,standard,FALSE,
"Amon Goeth, the sadistic Nazi commandant in Schindler's List is played by which actor?",Ralph Fiennes,text,1,,Movies,medium,text,standard,FALSE,
"Travis Bickle, the alienated veteran whose vigilantism turns violent in Taxi Driver is played by which actor?",Robert De Niro,text,1,,Movies,medium,text,standard,FALSE,
"Harry Lime, a charming racketeer profiting from diluted penicillin in The Third Man is played by which actor?",Orson Welles,text,1,,Movies,medium,text,standard,FALSE,
"Freddy Krueger, the dream-stalking killer with razor-gloved hands in A Nightmare on Elm Street is played by which actor?",Robert Englund,text,1,,Movies,medium,text,standard,FALSE,
"Verbal Kint, a deceptive storyteller hiding a criminal mastermind in The Usual Suspects is played by which actor?",Kevin Spacey,text,1,,Movies,medium,text,standard,FALSE,
"Which actor played the young Vito Corleone in 'The Godfather Part II,' winning an Oscar for a role mostly in Sicilian?",Robert De Niro,text,1,,Movies,medium,mcq,standard,FALSE,Al Pacino|Robert De Niro|James Caan|Marlon Brando
What was the official name of the mechanical shark that malfunctioned constantly during the filming of 'Jaws'?,Bruce,text,1,,Movies,medium,mcq,standard,FALSE,Wally|Leonard|Bruce|Sharky
"In the song 'Tik Tok', Kesha kicks dudes to the curb unless they look like which musician?",Mick Jagger,text,1,,Music,medium,mcq,standard,FALSE,John Mayer|James Taylor|Steven Tyler|Mick Jagger
Which singer born in London had the alter-ego Ziggy Stardust?,David Bowie,text,1,,Music,medium,text,standard,FALSE,
"Robert ""Mutt"" Lange produced albums for many bands, including AC/DC and Def Leppard. Which famous musician did he marry in 1993?",Shania Twain,text,1,,Music,medium,text,standard,FALSE,
"Released in 1999 and selling over 15 million copies, this album is the Red Hot Chili Peppers' most commercially successful.",Californication,text,1,,Music,medium,text,standard,FALSE,
Stone Temple Pilots signed with Atlantic Records in 1992. In which city in California did the band form?,San Diego,text,1,,Music,medium,text,standard,FALSE,
What lead singer of the band Blind Melon also sang backing vocals on several Guns N' Roses songs?,Shannon Hoon,text,1,,Music,medium,text,standard,FALSE,
"Daft Punk's funky smash ""Get Lucky"" featuring Pharrell Williams comes from which retro-inspired album?",Random Access Memories,text,1,,Music,medium,mcq,standard,FALSE,Human After All|Discovery|Random Access Memories|Homework
What musical term tells musicians to gradually get louder?,Crescendo,text,1,,Music,medium,text,standard,FALSE,
"Before forming the synth-pop duo Eurythmics, Annie Lennox was the lead singer for which British new wave band?",The Tourists,text,1,,Music,medium,mcq,standard,FALSE,Yazoo|Thompson Twins|The Buggles|The Tourists
"Before his solo career and Crosby, Stills, Nash & Young, what influential folk-rock group was Neil Young a key member of?",Buffalo Springfield,text,1,,Music,medium,mcq,standard,FALSE,Buffalo Springfield|The Byrds|The Mamas & the Papas|The Lovin' Spoonful
"After the Sex Pistols imploded, what influential post-punk band did John Lydon (fka Johnny Rotten) immediately form?",Public Image Ltd (PiL),text,1,,Music,medium,mcq,standard,FALSE,The Clash|Public Image Ltd (PiL)|The Damned|Siouxsie and the Banshees
Joseph Smith was the founder of what religion?,Mormonism,text,1,,Religion,medium,mcq,standard,FALSE,Hinduism|Mormonism|Buddhism|Scientology
What is the branch of medicine dealing with the skin?,Dermatology,text,1,,Science,medium,text,standard,FALSE,
What element has the chemical symbol Cu?,Copper,text,1,,Science,medium,text,standard,FALSE,
What winter sport involves sliding stones on ice towards a target?,Curling,text,1,,Sports,medium,text,standard,FALSE,
Luke Littler is the current world champion in which sport?,Darts,text,1,,Sports,medium,text,standard,FALSE,
In which US city are NFL team the Lions based?,Detroit,text,1,,Sports,medium,text,standard,FALSE,
What year was the first iPhone released?,2007,text,1,,Technology,medium,mcq,standard,FALSE,2005|2007|2009|2001
This mobile OS held the largest market share in 2012.,iOS,text,1,,Technology,medium,mcq,standard,FALSE,Symbian|Android|iOS|BlackBerry
"If you are experiencing horripilation, what is happening to your skin?",Goosebumps,text,1,,,medium,mcq,standard,FALSE,A mild rash|Excessive sweating|Sunburn peeling|Goosebumps
Elton John's signature song 'Rocket Man' tells the story of a lonely astronaut. From which of his albums did it launch?,Honky Chateau,text,1,,,medium,mcq,standard,FALSE,Honky Chateau|Don't Shoot Me I'm Only the Piano Player|Goodbye Yellow Brick Road|Madman Across the Water
What is the standard SI unit for temperature?,Kelvin,text,1,,,medium,mcq,standard,FALSE,Celsius|Rankine|Fahrenheit|Kelvin
The 'K' in Vitamin K is derived from the Danish and German word for what biological process?,Coagulation,text,1,,,medium,mcq,standard,FALSE,Coagulation|Bone calibration|Kidney function|Potassium balance
"Which country superstar sang the triumphant end-credits song, 'Ever Ever After,' for the movie 'Enchanted'?",Carrie Underwood,text,1,,,medium,mcq,standard,FALSE,Miranda Lambert|Carrie Underwood|Taylor Swift|Faith Hill
"What Justin Bieber #1 hit was originally written by Ed Sheeran for his own album ""/"" (Divide)?",Love Yourself,text,1,,,medium,mcq,standard,FALSE,Sorry|Cold Water|What Do You Mean?|Love Yourself
Logan Paul bought a 'Pikachu Illustrator' Pokemon card for a record-breaking price. How much did he pay?,"$5,275,000",text,1,,,medium,mcq,standard,FALSE,"$1,500,000|$2,780,000|$8,350,000|$5,275,000"
Which Australian pop singer has an aversion to the clanging sound of clothes hangers?,Kylie Minogue,text,1,,,medium,mcq,standard,FALSE,Sia|Natalie Imbruglia|Iggy Azalea|Kylie Minogue
"In Gainesville, Georgia, it is illegal to eat what food with a fork?",Fried chicken,text,1,,,medium,mcq,standard,FALSE,Tacos|Fried chicken|Pizza|Hamburgers
What Netflix show had the most streaming views in 2021?,Squid Game,text,1,,,medium,mcq,standard,FALSE,Squid Game|Money Heist|The Witcher|Bridgerton
